title,clean_title
Non-coding RNAs in disease: from mechanisms to therapeutics,noncoding rna disease mechanism therapeutic
Essentials of supply chain management,essential supply chain management
Benchmarking large language models for news summarization,benchmarking large language model news summarization
Erlebte und erzählte Lebensgeschichte: Gestalt und Struktur biographischer Selbstbeschreibungen,erlebte und erzählte lebensgeschichte gestalt und struktur biographischer selbstbeschreibungen
Adversarial diffusion distillation,adversarial diffusion distillation
Sastra Anak: Pengantar Pemahaman Dunia Anak Edisi Revisi,sastra anak pengantar pemahaman dunia anak edisi revisi
Gpt-4 passes the bar exam,gpt pass bar exam
Tirzepatide for metabolic dysfunction–associated steatohepatitis with liver fibrosis,tirzepatide metabolic dysfunction–associated steatohepatitis liver fibrosis
"Global incidence, prevalence, years lived with disability (YLDs), disability-adjusted life-years (DALYs), and healthy life expectancy (HALE) for 371 diseases and …",global incidence prevalence year lived disability ylds disabilityadjusted lifeyears dalys healthy life expectancy hale disease …
Pytorch 2: Faster machine learning through dynamic python bytecode transformation and graph compilation,pytorch faster machine learning dynamic python bytecode transformation graph compilation
C-pack: Packed resources for general chinese embeddings,cpack packed resource general chinese embeddings
Secure routing for mobile ad hoc networks,secure routing mobile ad hoc network
The ethics of ChatGPT–Exploring the ethical issues of an emerging technology,ethic chatgpt–exploring ethical issue emerging technology
Infectious Diseases Society of America 2024 guidance on the treatment of antimicrobial-resistant gram-negative infections,infectious disease society america guidance treatment antimicrobialresistant gramnegative infection
The chemistry of clay-organic reactions,chemistry clayorganic reaction
JASPAR 2024: 20th anniversary of the open-access database of transcription factor binding profiles,jaspar th anniversary openaccess database transcription factor binding profile
Is Bitcoin a real currency? An economic appraisal,bitcoin real currency economic appraisal
NF-κB in biology and targeted therapy: new insights and translational implications,nfκb biology targeted therapy new insight translational implication
Mechanisms controlling cellular and systemic iron homeostasis,mechanism controlling cellular systemic iron homeostasis
Community deployment of intermittent preventive treatment of malaria in pregnancy with sulfadoxine-pyrimethamine: a field guide,community deployment intermittent preventive treatment malaria pregnancy sulfadoxinepyrimethamine field guide
"Daratumumab, bortezomib, lenalidomide, and dexamethasone for multiple myeloma",daratumumab bortezomib lenalidomide dexamethasone multiple myeloma
Être et temps,être et temp
From realpolitik to dingpolitik or how to make things public,realpolitik dingpolitik make thing public
Human resource management,human resource management
""" do anything now"": Characterizing and evaluating in-the-wild jailbreak prompts on large language models",anything characterizing evaluating inthewild jailbreak prompt large language model
Principles of philosophy,principle philosophy
Más allá del bien y del mal: Preludio a una filosofía del futuro,más allá del bien del mal preludio una filosofía del futuro
Finerenone in heart failure with mildly reduced or preserved ejection fraction,finerenone heart failure mildly reduced preserved ejection fraction
Sugar: Surface-aligned gaussian splatting for efficient 3d mesh reconstruction and high-quality mesh rendering,sugar surfacealigned gaussian splatting efficient mesh reconstruction highquality mesh rendering
The economics of biodiversity,economics biodiversity
Recent advancement and assessment of green hydrogen production technologies,recent advancement assessment green hydrogen production technology
Князь мира сего,князь мира сего
The rise of ChatGPT: Exploring its potential in medical education,rise chatgpt exploring potential medical education
The bitcoin backbone protocol: Analysis and applications,bitcoin backbone protocol analysis application
Bifunctional electrocatalysts for overall and hybrid water splitting,bifunctional electrocatalysts overall hybrid water splitting
The world of late antiquity: AD 150-750,world late antiquity ad
Fiber optic sensors: an introduction for engineers and scientists,fiber optic sensor introduction engineer scientist
Eyes wide shut? exploring the visual shortcomings of multimodal llms,eye wide shut exploring visual shortcoming multimodal llm
Vbench: Comprehensive benchmark suite for video generative models,vbench comprehensive benchmark suite video generative model
Life span motor development,life span motor development
Repurposing diffusion-based image generators for monocular depth estimation,repurposing diffusionbased image generator monocular depth estimation
"Wayward lives, beautiful experiments: Intimate histories of social upheaval",wayward life beautiful experiment intimate history social upheaval
Let your life speak: Listening for the voice of vocation,let life speak listening voice vocation
Non-fullerene acceptor with asymmetric structure and phenyl-substituted alkyl side chain for 20.2% efficiency organic solar cells,nonfullerene acceptor asymmetric structure phenylsubstituted alkyl side chain efficiency organic solar cell
Outline of a Theory of Citizenship 1,outline theory citizenship
Les deux sources de la morale et de la religion,le deux source de la morale et de la religion
Stochastic integrals,stochastic integral
Gemma: Open models based on gemini research and technology,gemma open model based gemini research technology
Hoffbrand's essential haematology,hoffbrands essential haematology
Cellular and molecular mechanisms of skin wound healing,cellular molecular mechanism skin wound healing
Biomedical signal analysis,biomedical signal analysis
Lanthanide and actinide chemistry,lanthanide actinide chemistry
A guide to cell death pathways,guide cell death pathway
Multiple discrepancies theory (MDT),multiple discrepancy theory mdt
Medical decision making,medical decision making
Ribociclib plus endocrine therapy in early breast cancer,ribociclib plus endocrine therapy early breast cancer
Discurso político,discurso político
The complete poems,complete poem
Overall survival with adjuvant pembrolizumab in renal-cell carcinoma,overall survival adjuvant pembrolizumab renalcell carcinoma
Ser eo Nada: ensaio de ontologia fenomenológica,ser eo nada ensaio de ontologia fenomenológica
Vision-language models for vision tasks: A survey,visionlanguage model vision task survey
Deformable 3d gaussians for high-fidelity monocular dynamic scene reconstruction,deformable gaussians highfidelity monocular dynamic scene reconstruction
Représentations individuelles et représentations collectives,représentations individuelles et représentations collective
Cogagent: A visual language model for gui agents,cogagent visual language model gui agent
Qwen2. 5 technical report,qwen technical report
Multimodal foundation models: From specialists to general-purpose assistants,multimodal foundation model specialist generalpurpose assistant
Nonluoghi,nonluoghi
Perioperative nivolumab in resectable lung cancer,perioperative nivolumab resectable lung cancer
Reskilling and upskilling the future-ready workforce for industry 4.0 and beyond,reskilling upskilling futureready workforce industry beyond
Paleontological data analysis,paleontological data analysis
Understanding mechanisms of antioxidant action in health and disease,understanding mechanism antioxidant action health disease
Global burden of bacterial antimicrobial resistance 1990–2021: a systematic analysis with forecasts to 2050,global burden bacterial antimicrobial resistance – systematic analysis forecast
Smarter eco-cities and their leading-edge artificial intelligence of things solutions for environmental sustainability: A comprehensive systematic review,smarter ecocities leadingedge artificial intelligence thing solution environmental sustainability comprehensive systematic review
Point transformer v3: Simpler faster stronger,point transformer v simpler faster stronger
Educação e poder,educação e poder
Dissociating language and thought in large language models,dissociating language thought large language model
Fourier analysis,fourier analysis
How is ChatGPT's behavior changing over time?,chatgpts behavior changing time
Dire quasi la stessa cosa: esperienze di traduzione,dire quasi la stessa cosa esperienze di traduzione
Tirzepatide for the treatment of obstructive sleep apnea and obesity,tirzepatide treatment obstructive sleep apnea obesity
Self-play fine-tuning converts weak language models to strong language models,selfplay finetuning convert weak language model strong language model
Home girls: A Black feminist anthology,home girl black feminist anthology
"Generative artificial intelligence in marketing: Applications, opportunities, challenges, and research agenda",generative artificial intelligence marketing application opportunity challenge research agenda
Microbiologia,microbiologia
Working for ford,working ford
DeepSeek-Coder: When the Large Language Model Meets Programming--The Rise of Code Intelligence,deepseekcoder large language model meet programmingthe rise code intelligence
Thermoplastic elastomers,thermoplastic elastomer
A comprehensive survey on pretrained foundation models: A history from bert to chatgpt,comprehensive survey pretrained foundation model history bert chatgpt
Computational chemistry,computational chemistry
Apixaban for stroke prevention in subclinical atrial fibrillation,apixaban stroke prevention subclinical atrial fibrillation
Trial of early minimally invasive removal of intracerebral hemorrhage,trial early minimally invasive removal intracerebral hemorrhage
Мастер и Маргарита,мастер и маргарита
Fundamentals of weed science,fundamental weed science
Logs with zeros? Some problems and solutions,log zero problem solution
Theory and resistance in education: Towards a pedagogy for the opposition,theory resistance education towards pedagogy opposition
Phi-3 technical report: A highly capable language model locally on your phone,phi technical report highly capable language model locally phone
"Scaling speech technology to 1,000+ languages",scaling speech technology language
"The impact of Generative AI (GenAI) on practices, policies and research direction in education: A case of ChatGPT and Midjourney",impact generative ai genai practice policy research direction education case chatgpt midjourney
A phase 2 randomized trial of survodutide in MASH and fibrosis,phase randomized trial survodutide mash fibrosis
African language structures,african language structure
Sam 2: Segment anything in images and videos,sam segment anything image video
Dora: Weight-decomposed low-rank adaptation,dora weightdecomposed lowrank adaptation
Судебные доказательства,судебные доказательства
Neoadjuvant immunotherapy in locally advanced mismatch repair–deficient colon cancer,neoadjuvant immunotherapy locally advanced mismatch repair–deficient colon cancer
"Global, regional, and national burden of disorders affecting the nervous system, 1990–2021: a systematic analysis for the Global Burden of Disease Study …",global regional national burden disorder affecting nervous system – systematic analysis global burden disease study …
Cell death,cell death
Quality-of-life-inventory,qualityoflifeinventory
A plasmonic S-scheme Au/MIL-101 (Fe)/BiOBr photocatalyst for efficient synchronous decontamination of Cr (VI) and norfloxacin antibiotic,plasmonic sscheme aumil febiobr photocatalyst efficient synchronous decontamination cr vi norfloxacin antibiotic
To use or not to use ChatGPT in higher education? A study of students' acceptance and use of technology,use use chatgpt higher education study student acceptance use technology
The engineering design of systems: models and methods,engineering design system model method
Os seis Pilares da Autoestima,o seis pilares da autoestima
"O nascimento da tragédia, ou Helenismo e pessimismo",nascimento da tragédia ou helenismo e pessimismo
Gaussian splatting slam,gaussian splatting slam
Prolegomena to any future metaphysics,prolegomenon future metaphysics
Cognition and memory after Covid-19 in a large community sample,cognition memory covid large community sample
Benchmarking large language models in retrieval-augmented generation,benchmarking large language model retrievalaugmented generation
The sun also rises,sun also rise
"How to do a Systematic Literature Review in Nursing: A Step-by-Step Guide, 3/e",systematic literature review nursing stepbystep guide e
Self‐assembled interlayer enables high‐performance organic photovoltaics with power conversion efficiency exceeding 20%,self‐assembled interlayer enables high‐performance organic photovoltaics power conversion efficiency exceeding
Chatbot arena: An open platform for evaluating llms by human preference,chatbot arena open platform evaluating llm human preference
Kan: Kolmogorov-arnold networks,kan kolmogorovarnold network
"Uncertainty quantification: theory, implementation, and applications",uncertainty quantification theory implementation application
"Global burden of 288 causes of death and life expectancy decomposition in 204 countries and territories and 811 subnational locations, 1990–2021: a …",global burden cause death life expectancy decomposition country territory subnational location – …
A cell-free DNA blood-based test for colorectal cancer screening,cellfree dna bloodbased test colorectal cancer screening
The death of expertise: The campaign against established knowledge and why it matters,death expertise campaign established knowledge matter
Highly efficient and stable perovskite solar cells via a multifunctional hole transporting material,highly efficient stable perovskite solar cell via multifunctional hole transporting material
Transformative effects of ChatGPT on modern education: Emerging Era of AI Chatbots,transformative effect chatgpt modern education emerging era ai chatbots
Extracellular vesicles as tools and targets in therapy for diseases,extracellular vesicle tool target therapy disease
Yolo-world: Real-time open-vocabulary object detection,yoloworld realtime openvocabulary object detection
"Lidský vztah jako součást profese: Psychoterapeutické kapitoly pro sociální, pedagogické a zdravotnické profes",lidský vztah jako součást profese psychoterapeutické kapitoly pro sociální pedagogické zdravotnické profes
Monkey: Image resolution and text label are important things for large multi-modal models,monkey image resolution text label important thing large multimodal model
Computational principles of mobile robotics,computational principle mobile robotics
"Chemical dynamics in condensed phases: relaxation, transfer, and reactions in condensed molecular systems",chemical dynamic condensed phase relaxation transfer reaction condensed molecular system
Novel Resveratrol-Derived Sulfur-Rich Polymers: Advanced Materials for Silver Capture and High-Performance Lithium–Sulfur Battery Cathodes,novel resveratrolderived sulfurrich polymer advanced material silver capture highperformance lithium–sulfur battery cathode
International law in theory and practice,international law theory practice
Internvl: Scaling up vision foundation models and aligning for generic visual-linguistic tasks,internvl scaling vision foundation model aligning generic visuallinguistic task
"Before the Mayflower: A history of the Negro in America, 1619-1962",mayflower history negro america
A visual-language foundation model for computational pathology,visuallanguage foundation model computational pathology
College student retention: Formula for student success,college student retention formula student success
O mestre ignorante-cinco lições sobre a emancipação intelectual,mestre ignorantecinco lições sobre emancipação intelectual
La imaginación y el arte en la infancia,la imaginación el arte en la infancia
A foundation model for clinical-grade computational pathology and rare cancers detection,foundation model clinicalgrade computational pathology rare cancer detection
"Black Majority: Race, Rice, and Rebellion in South Carolina, 1670-1740",black majority race rice rebellion south carolina
U-mamba: Enhancing long-range dependency for biomedical image segmentation,umamba enhancing longrange dependency biomedical image segmentation
The molecular basis for cellular function of intrinsically disordered protein regions,molecular basis cellular function intrinsically disordered protein region
Lgm: Large multi-view gaussian model for high-resolution 3d content creation,lgm large multiview gaussian model highresolution content creation
A general theoretical paradigm to understand learning from human preferences,general theoretical paradigm understand learning human preference
"Advantages, challenges and molecular design of different material types used in organic solar cells",advantage challenge molecular design different material type used organic solar cell
Parkinson's law,parkinson law
Dust3r: Geometric 3d vision made easy,dustr geometric vision made easy
Empowerment in der sozialen Arbeit: eine Einführung,empowerment der sozialen arbeit eine einführung
Practical and ethical challenges of large language models in education: A systematic scoping review,practical ethical challenge large language model education systematic scoping review
Thinking: An experimental and social study,thinking experimental social study
Clinical trials: a methodologic perspective,clinical trial methodologic perspective
The evolution of the British welfare state: a history of social policy since the Industrial Revolution,evolution british welfare state history social policy since industrial revolution
European Union law: text and materials,european union law text material
The varieties of goodness,variety goodness
Motiondiffuse: Text-driven human motion generation with diffusion model,motiondiffuse textdriven human motion generation diffusion model
Collision and collusion: The strange case of Western aid to Eastern Europe 1989–1998,collision collusion strange case western aid eastern europe –
Generative multimodal models are in-context learners,generative multimodal model incontext learner
Supercapacitors,supercapacitors
8. The Fourth Industrial Revolution-What It Means and How to Respond,fourth industrial revolutionwhat mean respond
Tackling NCDs: best buys and other recommended interventions for the prevention and control of noncommunicable diseases,tackling ncds best buy recommended intervention prevention control noncommunicable disease
A survey on multimodal large language models for autonomous driving,survey multimodal large language model autonomous driving
Fueling the future: A comprehensive review of hydrogen energy systems and their challenges,fueling future comprehensive review hydrogen energy system challenge
"Abortion and woman's choice: the state, sexuality and reproductive freedom",abortion woman choice state sexuality reproductive freedom
Adapted large language models can outperform medical experts in clinical text summarization,adapted large language model outperform medical expert clinical text summarization
Electrospinning of nanofibres,electrospinning nanofibres
Continued treatment with tirzepatide for maintenance of weight reduction in adults with obesity: the SURMOUNT-4 randomized clinical trial,continued treatment tirzepatide maintenance weight reduction adult obesity surmount randomized clinical trial
The everyday language of white racism,everyday language white racism
Shape anisotropic chain‐like CoNi/polydimethylsiloxane composite films with excellent low‐frequency microwave absorption and high thermal conductivity,shape anisotropic chain‐like conipolydimethylsiloxane composite film excellent low‐frequency microwave absorption high thermal conductivity
"Money, credit and commerce",money credit commerce
Polymeric nanoparticles for drug delivery,polymeric nanoparticles drug delivery
The pillars of trustworthiness in qualitative research,pillar trustworthiness qualitative research
Rivers: form and process in alluvial channels,river form process alluvial channel
Identification of mobile genetic elements with geNomad,identification mobile genetic element genomad
Fundamentals of veterinary clinical pathology,fundamental veterinary clinical pathology
Ilmu Dakwah edisi revisi,ilmu dakwah edisi revisi
Augmenting large language models with chemistry tools,augmenting large language model chemistry tool
Essere e tempo,essere e tempo
Highly accurate blood test for Alzheimer's disease is similar or superior to clinical cerebrospinal fluid tests,highly accurate blood test alzheimers disease similar superior clinical cerebrospinal fluid test
Landscape Ecology: A Task-Oriented Perspective,landscape ecology taskoriented perspective
The spirit of democracy: The struggle to build free societies throughout the world,spirit democracy struggle build free society throughout world
Sense and nonsense: Evolutionary perspectives on human behaviour,sense nonsense evolutionary perspective human behaviour
Secular movements in production and prices,secular movement production price
Comprehensive classroom management: Creating communities of support and solving problems,comprehensive classroom management creating community support solving problem
Fractional quantum anomalous Hall effect in multilayer graphene,fractional quantum anomalous hall effect multilayer graphene
Durvalumab after chemoradiotherapy in limited-stage small-cell lung cancer,durvalumab chemoradiotherapy limitedstage smallcell lung cancer
Future research recommendations for transforming higher education with generative AI,future research recommendation transforming higher education generative ai
Teoria do jornalismo,teoria jornalismo
Green hydrogen: A pathway to a sustainable energy future,green hydrogen pathway sustainable energy future
Educational testing and measurement,educational testing measurement
Landscape: politics and perspectives,landscape politics perspective
The cell biology of ferroptosis,cell biology ferroptosis
High-entropy materials for energy and electronic applications,highentropy material energy electronic application
Crisis intervention strategies,crisis intervention strategy
Lectures on the calculus of variations and optimal control theory,lecture calculus variation optimal control theory
Dynamic 3d gaussians: Tracking by persistent dynamic view synthesis,dynamic gaussians tracking persistent dynamic view synthesis
Scaffold-gs: Structured 3d gaussians for view-adaptive rendering,scaffoldgs structured gaussians viewadaptive rendering
A cidade,cidade
Metode penelitian kualitatif,metode penelitian kualitatif
How nations negotiate,nation negotiate
"Global age-sex-specific mortality, life expectancy, and population estimates in 204 countries and territories and 811 subnational locations, 1950–2021, and …",global agesexspecific mortality life expectancy population estimate country territory subnational location – …
Electoral change: Responses to evolving social and attitudinal structures in Western countries,electoral change response evolving social attitudinal structure western country
Introduction: Regional innovation systems–an evolutionary approach,introduction regional innovation systems–an evolutionary approach
Democracy in America: Vol. 1,democracy america vol
Buried interface molecular hybrid for inverted perovskite solar cells,buried interface molecular hybrid inverted perovskite solar cell
EULAR recommendations for the management of systemic lupus erythematosus: 2023 update,eular recommendation management systemic lupus erythematosus update
A first course in Sobolev spaces,first course sobolev space
Toward a concept of workable competition,toward concept workable competition
ChatGPT makes medicine easy to swallow: an exploratory case study on simplified radiology reports,chatgpt make medicine easy swallow exploratory case study simplified radiology report
Artificial intelligence in drug discovery and development,artificial intelligence drug discovery development
Repvit: Revisiting mobile cnn from vit perspective,repvit revisiting mobile cnn vit perspective
Design principles for strong and tough hydrogels,design principle strong tough hydrogel
"Supplément aux dictionnaires arabes, Tome second",supplément aux dictionnaires arabes tome second
π-Extended nonfullerene acceptor for compressed molecular packing in organic solar cells to achieve over 20% efficiency,πextended nonfullerene acceptor compressed molecular packing organic solar cell achieve efficiency
Talking about large language models,talking large language model
Highly pathogenic avian influenza A (H5N1) virus infection in a dairy farm worker,highly pathogenic avian influenza hn virus infection dairy farm worker
Sensibility: an introduction,sensibility introduction
Ella Baker and the Black freedom movement: A radical democratic vision,ella baker black freedom movement radical democratic vision
Conferencias sobre la introducción al psicoanálisis,conferencias sobre la introducción al psicoanálisis
Unveiling cutting‐edge developments in electrocatalytic nitrate‐to‐ammonia conversion,unveiling cutting‐edge development electrocatalytic nitrate‐to‐ammonia conversion
