title,clean_title
Moviechat: From dense token to sparse memory for long video understanding,moviechat dense token sparse memory long video understanding
A strongly coupled Ru–CrOx cluster–cluster heterostructure for efficient alkaline hydrogen electrocatalysis,strongly coupled ru–crox cluster–cluster heterostructure efficient alkaline hydrogen electrocatalysis
Magicanimate: Temporally consistent human image animation using diffusion model,magicanimate temporally consistent human image animation using diffusion model
A people betrayed: the role of the West in Rwanda's genocide,people betrayed role west rwanda genocide
Seed-bench: Benchmarking multimodal large language models,seedbench benchmarking multimodal large language model
Power hungry processing: Watts driving the cost of ai deployment?,power hungry processing watt driving cost ai deployment
Efficacy and safety of acoramidis in transthyretin amyloid cardiomyopathy,efficacy safety acoramidis transthyretin amyloid cardiomyopathy
Andexanet for factor Xa inhibitor–associated acute intracerebral hemorrhage,andexanet factor xa inhibitor–associated acute intracerebral hemorrhage
Handbook of functional MRI data analysis,handbook functional mri data analysis
Бытие и сознание,бытие и сознание
The poet's voice: essays on poetics and Greek literature,poet voice essay poetics greek literature
The senescence-associated secretory phenotype and its physiological and pathological implications,senescenceassociated secretory phenotype physiological pathological implication
Mitigating object hallucinations in large vision-language models through visual contrastive decoding,mitigating object hallucination large visionlanguage model visual contrastive decoding
Linear algebra done right,linear algebra done right
AI models collapse when trained on recursively generated data,ai model collapse trained recursively generated data
Hale's Medications & Mothers' Milk 2025-2026: A Manual of Lactational Pharmacology,hale medication mother milk manual lactational pharmacology
Mass education as a determinant of the timing of fertility decline,mass education determinant timing fertility decline
Situationist international anthology,situationist international anthology
Unleashing the power of edge-cloud generative AI in mobile networks: A survey of AIGC services,unleashing power edgecloud generative ai mobile network survey aigc service
Evaluation and mitigation of the limitations of large language models in clinical decision-making,evaluation mitigation limitation large language model clinical decisionmaking
A deep learning system for predicting time to progression of diabetic retinopathy,deep learning system predicting time progression diabetic retinopathy
Biochar effects on soil nutrient transformations,biochar effect soil nutrient transformation
Emotion recognition and artificial intelligence: A systematic review (2014–2023) and research recommendations,emotion recognition artificial intelligence systematic review – research recommendation
Panda-70m: Captioning 70m videos with multiple cross-modality teachers,pandam captioning video multiple crossmodality teacher
A personagem,personagem
"Short-chain fatty acids: linking diet, the microbiome and immunity",shortchain fatty acid linking diet microbiome immunity
Fenomenografi,fenomenografi
Instantbooth: Personalized text-to-image generation without test-time finetuning,instantbooth personalized texttoimage generation without testtime finetuning
Altermagnetic lifting of Kramers spin degeneracy,altermagnetic lifting kramers spin degeneracy
Mobile aloha: Learning bimanual mobile manipulation with low-cost whole-body teleoperation,mobile aloha learning bimanual mobile manipulation lowcost wholebody teleoperation
Enhancing photocatalytic H2O2 production with Au co-catalysts through electronic structure modification,enhancing photocatalytic ho production au cocatalysts electronic structure modification
Intrathecal bivalent CAR T cells targeting EGFR and IL13Rα2 in recurrent glioblastoma: phase 1 trial interim results,intrathecal bivalent car cell targeting egfr ilrα recurrent glioblastoma phase trial interim result
Robust adaptive control,robust adaptive control
Ricerche filosofiche,ricerche filosofiche
Robustness and resilience of complex networks,robustness resilience complex network
Crítica da razão cínica,crítica da razão cínica
Worldwide vitamin D status,worldwide vitamin status
Critical transitions in the Amazon forest system,critical transition amazon forest system
Discovery of a structural class of antibiotics with explainable deep learning,discovery structural class antibiotic explainable deep learning
Measuring EFL learners' use of ChatGPT in informal digital learning of English based on the technology acceptance model,measuring efl learner use chatgpt informal digital learning english based technology acceptance model
RSV prefusion F protein–based maternal vaccine—preterm birth and other outcomes,rsv prefusion f protein–based maternal vaccine—preterm birth outcome
FUTURE-PROOF YOUR FINANCES-ADAPTING TO CHANGING REGULATION POLICIES IN THE MONEY CYCLE,futureproof financesadapting changing regulation policy money cycle
"The practice of electroconvulsive therapy: recommendations for treatment, training, and privileging (A task force report of the American Psychiatric Association …",practice electroconvulsive therapy recommendation treatment training privileging task force report american psychiatric association …
Medical image segmentation review: The success of u-net,medical image segmentation review success unet
Ligand-channel-enabled ultrafast Li-ion conduction,ligandchannelenabled ultrafast liion conduction
HOW REGULATION POLICIES INFLUENCE THE FLOW OF MONEY-AN IN-DEPTH ANALYSIS OF THE MONEY CYCLE,regulation policy influence flow moneyan indepth analysis money cycle
Adeno-associated virus as a delivery vector for gene therapy of human diseases,adenoassociated virus delivery vector gene therapy human disease
Introduction to artificial intelligence,introduction artificial intelligence
Ego-exo4d: Understanding skilled human activity from first-and third-person perspectives,egoexod understanding skilled human activity firstand thirdperson perspective
Analyzing and improving the training dynamics of diffusion models,analyzing improving training dynamic diffusion model
When and how artificial intelligence augments employee creativity,artificial intelligence augments employee creativity
Proyek penguatan profil pelajar pancasila: Sebuah orientasi baru pendidikan dalam meningkatkan karakter siswa indonesia,proyek penguatan profil pelajar pancasila sebuah orientasi baru pendidikan dalam meningkatkan karakter siswa indonesia
The Metaverse: A new digital frontier for consumer behavior,metaverse new digital frontier consumer behavior
T cell lymphoma and secondary primary malignancy risk after commercial CAR T cell therapy,cell lymphoma secondary primary malignancy risk commercial car cell therapy
Cotracker: It is better to track together,cotracker better track together
APOE4 homozygosity represents a distinct genetic form of Alzheimer's disease,apoe homozygosity represents distinct genetic form alzheimers disease
Human Digital Twin in the context of Industry 5.0,human digital twin context industry
Idea for a universal history with a cosmopolitan purpose,idea universal history cosmopolitan purpose
Frailty in older adults,frailty older adult
Why the Allies won,ally
Efficient bubble/precipitate traffic enables stable seawater reduction electrocatalysis at industrial-level current densities,efficient bubbleprecipitate traffic enables stable seawater reduction electrocatalysis industriallevel current density
Vm-unet: Vision mamba unet for medical image segmentation,vmunet vision mamba unet medical image segmentation
Методика преподавания русского языка,методика преподавания русского языка
19.7% efficiency binary organic solar cells achieved by selective core fluorination of nonfullerene electron acceptors,efficiency binary organic solar cell achieved selective core fluorination nonfullerene electron acceptor
Using clusterProfiler to characterize multiomics data,using clusterprofiler characterize multiomics data
Global political economy: Evolution and dynamics,global political economy evolution dynamic
State estimation for robotics,state estimation robotics
Gaussianeditor: Swift and controllable 3d editing with gaussian splatting,gaussianeditor swift controllable editing gaussian splatting
Llama-vid: An image is worth 2 tokens in large language models,llamavid image worth token large language model
Layered structural PBAT composite foams for efficient electromagnetic interference shielding,layered structural pbat composite foam efficient electromagnetic interference shielding
Ischemia-reperfusion injury: molecular mechanisms and therapeutic targets,ischemiareperfusion injury molecular mechanism therapeutic target
"Hydrogen-powered horizons: Transformative technologies in clean energy generation, distribution, and storage for sustainable innovation",hydrogenpowered horizon transformative technology clean energy generation distribution storage sustainable innovation
Pengantar ilmu sosial: Sebuah kajian pendekatan struktural,pengantar ilmu sosial sebuah kajian pendekatan struktural
"Artificial Intelligence Trust, risk and security management (AI trism): Frameworks, applications, challenges and future research directions",artificial intelligence trust risk security management ai trism framework application challenge future research direction
The Future of Influencer Marketing: Evolution of Consumer Behavior in the Digital World,future influencer marketing evolution consumer behavior digital world
Human capital,human capital
Timechat: A time-sensitive multimodal large language model for long video understanding,timechat timesensitive multimodal large language model long video understanding
Origin of fast charging in hard carbon anodes,origin fast charging hard carbon anode
Language models are super mario: Absorbing abilities from homologous models as a free lunch,language model super mario absorbing ability homologous model free lunch
Designing electrolytes and interphases for high-energy lithium batteries,designing electrolyte interphases highenergy lithium battery
Exagamglogene autotemcel for severe sickle cell disease,exagamglogene autotemcel severe sickle cell disease
Structured information extraction from scientific text with large language models,structured information extraction scientific text large language model
Tailoring oxygen reduction reaction kinetics of Fe− N− C catalyst via spin manipulation for efficient zinc–air batteries,tailoring oxygen reduction reaction kinetics fe− n− c catalyst via spin manipulation efficient zinc–air battery
Essays on the great depression,essay great depression
Magical urbanism: Latinos reinvent the US city,magical urbanism latino reinvent u city
Metode penelitian kuantitatif,metode penelitian kuantitatif
Overall survival with pembrolizumab in early-stage triple-negative breast cancer,overall survival pembrolizumab earlystage triplenegative breast cancer
Distinct evolution of SARS-CoV-2 Omicron XBB and BA. 2.86/JN. 1 lineages combining increased fitness and antibody evasion,distinct evolution sarscov omicron xbb ba jn lineage combining increased fitness antibody evasion
Editor's choice--European Society for Vascular Surgery (ESVS) 2024 clinical practice guidelines on the management of abdominal aorto-iliac artery …,editor choiceeuropean society vascular surgery esvs clinical practice guideline management abdominal aortoiliac artery …
{DistServe}: Disaggregating prefill and decoding for goodput-optimized large language model serving,distserve disaggregating prefill decoding goodputoptimized large language model serving
The state of carbon dioxide removal,state carbon dioxide removal
Hallusionbench: an advanced diagnostic suite for entangled language hallucination and visual illusion in large vision-language models,hallusionbench advanced diagnostic suite entangled language hallucination visual illusion large visionlanguage model
Toward the commercialization of perovskite solar modules,toward commercialization perovskite solar module
"Belantamab mafodotin, bortezomib, and dexamethasone for multiple myeloma",belantamab mafodotin bortezomib dexamethasone multiple myeloma
Caosmosi,caosmosi
Design and application of fluorescent probes to detect cellular physical microenvironments,design application fluorescent probe detect cellular physical microenvironments
On the historical unity of Russians and Ukrainians,historical unity russian ukrainian
A small and vigorous black hole in the early Universe,small vigorous black hole early universe
Evolutionary socialism,evolutionary socialism
Exploring the next generation of antibody–drug conjugates,exploring next generation antibody–drug conjugate
Intensive ambulance-delivered blood-pressure reduction in hyperacute stroke,intensive ambulancedelivered bloodpressure reduction hyperacute stroke
Diversity's promise for higher education: Making it work,diversity promise higher education making work
Opera: Alleviating hallucination in multi-modal large language models via over-trust penalty and retrospection-allocation,opera alleviating hallucination multimodal large language model via overtrust penalty retrospectionallocation
Trained transformers learn linear models in-context,trained transformer learn linear model incontext
Encyclopedia of electrochemical power sources,encyclopedia electrochemical power source
Repeated Omicron exposures override ancestral SARS-CoV-2 immune imprinting,repeated omicron exposure override ancestral sarscov immune imprinting
OpenFold: Retraining AlphaFold2 yields new insights into its learning mechanisms and capacity for generalization,openfold retraining alphafold yield new insight learning mechanism capacity generalization
Nucleotide Transformer: building and evaluating robust foundation models for human genomics,nucleotide transformer building evaluating robust foundation model human genomics
Review of the efficacy of nanoparticle-based drug delivery systems for cancer treatment,review efficacy nanoparticlebased drug delivery system cancer treatment
Transforming Digital Consumers: The Power of Viral Diffusion in Consumer Behavior,transforming digital consumer power viral diffusion consumer behavior
Effect size guidelines for cross-lagged effects.,effect size guideline crosslagged effect
A Gothic Etymological Dictionary: Based on the Third Edition of Vergleichendes Wörterbuch der Gotischen Sprache by Sigmund Feist. With Bibliography …,gothic etymological dictionary based third edition vergleichendes wörterbuch der gotischen sprache sigmund feist bibliography …
Metal-organic frameworks with fine-tuned interlayer spacing for microwave absorption,metalorganic framework finetuned interlayer spacing microwave absorption
The era of 1-bit llms: All large language models are in 1.58 bits,era bit llm large language model bit
Medsegdiff: Medical image segmentation with diffusion probabilistic model,medsegdiff medical image segmentation diffusion probabilistic model
"TGF-β signaling in health, disease and therapeutics",tgfβ signaling health disease therapeutic
Corpus of Hieroglyphic Luwian Inscriptions: Volume III: Inscriptions of the Hettite Empire and New Inscriptions of the Iron Age,corpus hieroglyphic luwian inscription volume iii inscription hettite empire new inscription iron age
"Psicologia das habilidades sociais: terapia, educação e trabalho",psicologia da habilidades sociais terapia educação e trabalho
Autoencoders and their applications in machine learning: a survey,autoencoders application machine learning survey
Drivelm: Driving with graph visual question answering,drivelm driving graph visual question answering
"Spectres de Marx: l'état de la dette, le travail du deuil et la nouvelle Internationale",spectre de marx létat de la dette le travail du deuil et la nouvelle internationale
Hardware implementation of memristor-based artificial neural networks,hardware implementation memristorbased artificial neural network
Fibroblast and myofibroblast activation in normal tissue repair and fibrosis,fibroblast myofibroblast activation normal tissue repair fibrosis
Unified-io 2: Scaling autoregressive multimodal models with vision language audio and action,unifiedio scaling autoregressive multimodal model vision language audio action
The struggle for Black equality,struggle black equality
sejarah peradaban Islam,sejarah peradaban islam
Clarifying the four core effects of high-entropy materials,clarifying four core effect highentropy material
The SRG/eROSITA all-sky survey-First X-ray catalogues and data release of the western Galactic hemisphere,srgerosita allsky surveyfirst xray catalogue data release western galactic hemisphere
Geographic thought: A critical introduction,geographic thought critical introduction
Neural prompt search,neural prompt search
Diffbir: Toward blind image restoration with generative diffusion prior,diffbir toward blind image restoration generative diffusion prior
ChatGPT in education: A blessing or a curse? A qualitative study exploring early adopters' utilization and perceptions,chatgpt education blessing curse qualitative study exploring early adopter utilization perception
Political elites,political elite
Making room: Recovering hospitality as a Christian tradition,making room recovering hospitality christian tradition
The progress of g-C3N4 in photocatalytic H2 evolution: From fabrication to modification,progress gcn photocatalytic h evolution fabrication modification
The legal production of Mexican/migrant “illegality”,legal production mexicanmigrant “ illegality ”
Segmamba: Long-range sequential modeling mamba for 3d medical image segmentation,segmamba longrange sequential modeling mamba medical image segmentation
"The biochemical pathways of apoptotic, necroptotic, pyroptotic, and ferroptotic cell death",biochemical pathway apoptotic necroptotic pyroptotic ferroptotic cell death
Triplane meets gaussian splatting: Fast and generalizable single-view 3d reconstruction with transformers,triplane meet gaussian splatting fast generalizable singleview reconstruction transformer
The worldwide governance indicators,worldwide governance indicator
Towards 26% efficiency in inverted perovskite solar cells via interfacial flipped band bending and suppressed deep-level traps,towards efficiency inverted perovskite solar cell via interfacial flipped band bending suppressed deeplevel trap
Lectures on the Philosophy of Religion,lecture philosophy religion
LOWEST NUMBER OF DAILY HOURS OF SUNSHINE IS RELATED TO MAXIMUM TEMPERATURE IN FOREST RED MILLIPEDES CENTROBOLUS COOK …,lowest number daily hour sunshine related maximum temperature forest red millipede centrobolus cook …
MASLD: a systemic metabolic disorder with cardiovascular and malignant complications,masld systemic metabolic disorder cardiovascular malignant complication
Testing theory of mind in large language models and humans,testing theory mind large language model human
2024 ESC guidelines for the management of chronic coronary syndromes: developed by the task force for the management of chronic coronary syndromes of the …,esc guideline management chronic coronary syndrome developed task force management chronic coronary syndrome …
El plan de marketing en la práctica,el plan de marketing en la práctica
Thyroid cancer: a review,thyroid cancer review
Revisiting the universal principle for the rational design of single-atom electrocatalysts,revisiting universal principle rational design singleatom electrocatalysts
Detection of mosaic and population-level structural variants with Sniffles2,detection mosaic populationlevel structural variant sniffle
Compact 3d gaussian representation for radiance field,compact gaussian representation radiance field
Engineering hosts for Zn anodes in aqueous Zn-ion batteries,engineering host zn anode aqueous znion battery
In vivo NIR-II fluorescence imaging for biology and medicine,vivo nirii fluorescence imaging biology medicine
ПОЛИКУЛЬТУРНОЕ ОБРАЗОВАНИЕ–АКТУАЛЬНАЯ ПРОБЛЕМА СОВРЕМЕННОЙ РОССИЙСКОЙ ШКОЛЫ,поликультурное образование–актуальная проблема современной российской школы
Diffusion model alignment using direct preference optimization,diffusion model alignment using direct preference optimization
Sobre el diálogo,sobre el diálogo
Sit: Exploring flow and diffusion-based generative models with scalable interpolant transformers,sit exploring flow diffusionbased generative model scalable interpolant transformer
Recyclable and (bio) degradable polyesters in a circular plastics economy,recyclable bio degradable polyester circular plastic economy
Toplum sözleşmesi,toplum sözleşmesi
Consistent thermal conductivities of spring‐like structured polydimethylsiloxane composites under large deformation,consistent thermal conductivity spring‐like structured polydimethylsiloxane composite large deformation
Post-Newtonian theory for gravitational waves,postnewtonian theory gravitational wave
Metaphysical foundations of natural science,metaphysical foundation natural science
Восемнадцатое брюмера Луи Бонапарта,восемнадцатое брюмера луи бонапарта
Reconfusion: 3d reconstruction with diffusion priors,reconfusion reconstruction diffusion prior
Rules versus authorities in monetary policy,rule versus authority monetary policy
"Molecular Intercalation‐Induced Two‐Phase Evolution Engineering of 1T and 2H‐MS2 (M = Mo, V, W) for Interface‐Polarization‐Enhanced Electromagnetic …",molecular intercalation‐induced two‐phase evolution engineering h‐ms mo v w interface‐polarization‐enhanced electromagnetic …
Efficient evolution of human antibodies from general protein language models,efficient evolution human antibody general protein language model
Large-scale foundation model on single-cell transcriptomics,largescale foundation model singlecell transcriptomics
"Embracing the future of Artificial Intelligence in the classroom: the relevance of AI literacy, prompt engineering, and critical thinking in modern education",embracing future artificial intelligence classroom relevance ai literacy prompt engineering critical thinking modern education
Fire retardancy of polymeric materials,fire retardancy polymeric material
High-speed and large-scale intrinsically stretchable integrated circuits,highspeed largescale intrinsically stretchable integrated circuit
Recognize anything: A strong image tagging model,recognize anything strong image tagging model
Detecting and preventing hallucinations in large vision language models,detecting preventing hallucination large vision language model
Animal tool behavior: the use and manufacture of tools by animals,animal tool behavior use manufacture tool animal
"The transformation of work?: Skill, flexibility and the labour process",transformation work skill flexibility labour process
International consensus criteria for pediatric sepsis and septic shock,international consensus criterion pediatric sepsis septic shock
Manipulating CNT films with atomic precision for absorption effectiveness–enhanced electromagnetic interference shielding and adaptive infrared camouflage,manipulating cnt film atomic precision absorption effectiveness–enhanced electromagnetic interference shielding adaptive infrared camouflage
Efficientsam: Leveraged masked image pretraining for efficient segment anything,efficientsam leveraged masked image pretraining efficient segment anything
Safe electrolyte for long-cycling alkali-ion batteries,safe electrolyte longcycling alkaliion battery
Начало и вечность жизни,начало и вечность жизни
A triple increase in global river basins with water scarcity due to future pollution,triple increase global river basin water scarcity due future pollution
"AIR PRESSURE IS NOT RELATED TO SPECIES RICHNESS IN SPHAEROTHERIIDAE BRANDT, 1833",air pressure related specie richness sphaerotheriidae brandt
"The roles and regulatory mechanisms of TGF-β and BMP signaling in bone and cartilage development, homeostasis and disease",role regulatory mechanism tgfβ bmp signaling bone cartilage development homeostasis disease
"MM1: methods, analysis and insights from multimodal LLM pre-training",mm method analysis insight multimodal llm pretraining
Apolipoprotein A1 infusions and cardiovascular outcomes after acute myocardial infarction,apolipoprotein infusion cardiovascular outcome acute myocardial infarction
Causal machine learning for predicting treatment outcomes,causal machine learning predicting treatment outcome
Donor–acceptor mutually diluted heterojunctions for layer-by-layer fabrication of high-performance organic solar cells,donor–acceptor mutually diluted heterojunctions layerbylayer fabrication highperformance organic solar cell
"Health psychology: Theory, research and practice",health psychology theory research practice
Two-dimensional perovskite oxide as a photoactive high-κ gate dielectric,twodimensional perovskite oxide photoactive highκ gate dielectric
"Financial innovation and digitalization promote business growth: The interplay of green technology innovation, product market competition and firm …",financial innovation digitalization promote business growth interplay green technology innovation product market competition firm …
Психология личности,психология личности
