title,clean_title
N-doped carbon nanotube arrays Encapsuled with cobalt‑nickel alloy as superior free-standing electrodes for ultrahigh-rate hydrogen peroxide production,ndoped carbon nanotube array encapsuled cobalt‑nickel alloy superior freestanding electrode ultrahighrate hydrogen peroxide production
Tool learning with foundation models,tool learning foundation model
Segment anything model for medical images?,segment anything model medical image
A modell of Christian charity,modell christian charity
Coercion and distribution in a supposedly non-coercive state,coercion distribution supposedly noncoercive state
Refractiveindex. info database of optical constants,refractiveindex info database optical constant
Political corruption: A handbook,political corruption handbook
Screening for lung cancer: 2023 guideline update from the American Cancer Society,screening lung cancer guideline update american cancer society
Epidemiology and the people's health: theory and context,epidemiology people health theory context
Discursos sobre a primeira década de Tito Lívio,discursos sobre primeira década de tito lívio
Successful coaching,successful coaching
Videocrafter2: Overcoming data limitations for high-quality video diffusion models,videocrafter overcoming data limitation highquality video diffusion model
Time series: a biostatistical introduction,time series biostatistical introduction
Advances in thermal energy storage: Fundamentals and applications,advance thermal energy storage fundamental application
Interfacial polarization loss improvement induced by the hollow engineering of necklace‐like PAN/carbon nanofibers for boosted microwave absorption,interfacial polarization loss improvement induced hollow engineering necklace‐like pancarbon nanofibers boosted microwave absorption
The opportunities and challenges of ChatGPT in education,opportunity challenge chatgpt education
Self-expanding or balloon-expandable TAVR in patients with a small aortic annulus,selfexpanding balloonexpandable tavr patient small aortic annulus
The reactome pathway knowledgebase 2024,reactome pathway knowledgebase
European association of urology guidelines on muscle-invasive and metastatic bladder cancer: summary of the 2023 guidelines,european association urology guideline muscleinvasive metastatic bladder cancer summary guideline
Los filósofos presocráticos: historia crítica con selección de textos,los filósofos presocráticos historia crítica con selección de textos
Fast evolution of SARS-CoV-2 BA. 2.86 to JN. 1 under heavy immune pressure,fast evolution sarscov ba jn heavy immune pressure
High-threshold and low-overhead fault-tolerant quantum memory,highthreshold lowoverhead faulttolerant quantum memory
The pathogenesis of Parkinson's disease,pathogenesis parkinson disease
How far are we to gpt-4v? closing the gap to commercial multimodal models with open-source suites,far gptv closing gap commercial multimodal model opensource suite
Smart grids and renewable energy systems: Perspectives and grid integration challenges,smart grid renewable energy system perspective grid integration challenge
Lenses on reading,lens reading
"The inverse Gaussian distribution: theory: methodology, and applications",inverse gaussian distribution theory methodology application
The faiss library,faiss library
Chat-univi: Unified visual representation empowers large language models with image and video understanding,chatunivi unified visual representation empowers large language model image video understanding
The mindful way through depression: Freeing yourself from chronic unhappiness,mindful way depression freeing chronic unhappiness
Urbanization,urbanization
Anydoor: Zero-shot object-level image customization,anydoor zeroshot objectlevel image customization
The concept of activity in Soviet psychology,concept activity soviet psychology
Random graphs and complex networks,random graph complex network
Lectures on the History of Philosophy,lecture history philosophy
A survey on model compression for large language models,survey model compression large language model
The economics of industry,economics industry
TTD: Therapeutic Target Database describing target druggability information,ttd therapeutic target database describing target druggability information
Beta-blockers after myocardial infarction and preserved ejection fraction,betablockers myocardial infarction preserved ejection fraction
"Dementia prevention, intervention, and care: 2024 report of the Lancet standing Commission",dementia prevention intervention care report lancet standing commission
Linear and nonlinear structural mechanics,linear nonlinear structural mechanic
Difference-in-differences with a continuous treatment,differenceindifferences continuous treatment
Stretchable graphene–hydrogel interfaces for wearable and implantable bioelectronics,stretchable graphene–hydrogel interface wearable implantable bioelectronics
Teacher support and student motivation to learn with Artificial Intelligence (AI) based chatbot,teacher support student motivation learn artificial intelligence ai based chatbot
The Southeastern Indians,southeastern indian
Учение о лесе,учение о лесе
"A review on large language models: Architectures, applications, taxonomies, open issues and challenges",review large language model architecture application taxonomy open issue challenge
The quantum physics of atomic frequency standards: recent developments,quantum physic atomic frequency standard recent development
Infectious Diseases Society of America Guidelines on the treatment and management of patients with COVID-19 (April 2020),infectious disease society america guideline treatment management patient covid april
S-scheme heterojunction in photocatalytic hydrogen production,sscheme heterojunction photocatalytic hydrogen production
Chatgpt for robotics: Design principles and model abilities,chatgpt robotics design principle model ability
A review of carbon dots in synthesis strategy,review carbon dot synthesis strategy
"Nanozymes: definition, activity, and mechanisms",nanozymes definition activity mechanism
Social science and social pathology,social science social pathology
Electrochemical hydrogen storage materials: state-of-the-art and future perspectives,electrochemical hydrogen storage material stateoftheart future perspective
Лексикология английского языка,лексикология английского языка
pixelsplat: 3d gaussian splats from image pairs for scalable generalizable 3d reconstruction,pixelsplat gaussian splat image pair scalable generalizable reconstruction
Detecting hallucinations in large language models using semantic entropy,detecting hallucination large language model using semantic entropy
The state tradition in Western Europe: A study of an idea and institution,state tradition western europe study idea institution
Leveraging large language models for predictive chemistry,leveraging large language model predictive chemistry
Natureza humana,natureza humana
La grande trasformazione. Le origini economiche e sociali della nostra epoca,la grande trasformazione le origini economiche e sociali della nostra epoca
The cuckoo's egg: tracking a spy through the maze of computer espionage,cuckoo egg tracking spy maze computer espionage
Psicologia das relações interpessoais: vivências para o trabalho em grupo,psicologia da relações interpessoais vivências para trabalho em grupo
Is it harmful or helpful? Examining the causes and consequences of generative AI usage among university students,harmful helpful examining cause consequence generative ai usage among university student
Ultrafast electron transfer at the In2O3/Nb2O5 S-scheme interface for CO2 photoreduction,ultrafast electron transfer inonbo sscheme interface co photoreduction
La historia política del Nunca Más: la memoria de las desapariciones en la Argentina,la historia política del nunca más la memoria de la desapariciones en la argentina
Assessment pembelajaran,assessment pembelajaran
Predicting multiple conformations via sequence clustering and AlphaFold2,predicting multiple conformation via sequence clustering alphafold
COF/In2S3 S‐Scheme Photocatalyst with Enhanced Light Absorption and H2O2‐Production Activity and fs‐TA Investigation,cofins s‐scheme photocatalyst enhanced light absorption ho‐production activity fs‐ta investigation
Text-to-3d using gaussian splatting,texttod using gaussian splatting
Biomarker changes during 20 years preceding Alzheimer's disease,biomarker change year preceding alzheimers disease
"A meta systematic review of artificial intelligence in higher education: A call for increased ethics, collaboration, and rigour",meta systematic review artificial intelligence higher education call increased ethic collaboration rigour
Rapid single-particle chemical imaging of nanoplastics by SRS microscopy,rapid singleparticle chemical imaging nanoplastics sr microscopy
Человек в литературе древней Руси,человек в литературе древней руси
Plant-derived natural products: a source for drug discovery and development,plantderived natural product source drug discovery development
Intraventricular CARv3-TEAM-E T cells in recurrent glioblastoma,intraventricular carvteame cell recurrent glioblastoma
Large language model based multi-agents: A survey of progress and challenges,large language model based multiagents survey progress challenge
Assessing the potential of GPT-4 to perpetuate racial and gender biases in health care: a model evaluation study,assessing potential gpt perpetuate racial gender bias health care model evaluation study
Toward direct regeneration of spent lithium-ion batteries: a next-generation recycling method,toward direct regeneration spent lithiumion battery nextgeneration recycling method
Fundamentals of redox regulation in biology,fundamental redox regulation biology
Das Ich und das Es/Я и Оно,da ich und da esя и оно
Review on f (Q) gravity,review f q gravity
Sustained human outbreak of a new MPXV clade I lineage in eastern Democratic Republic of the Congo,sustained human outbreak new mpxv clade lineage eastern democratic republic congo
Federal antitrust policy: the law of competition and its practice,federal antitrust policy law competition practice
End-to-end autonomous driving: Challenges and frontiers,endtoend autonomous driving challenge frontier
Cost curves and supply curves,cost curve supply curve
Counterfactual explanations and how to find them: literature review and benchmarking,counterfactual explanation find literature review benchmarking
Direito financeiro e tributário,direito financeiro e tributário
"The emotional lives of animals: A leading scientist explores animal joy, sorrow, and empathy—and why they matter",emotional life animal leading scientist explores animal joy sorrow empathy—and matter
Recent advances in rational design for high-performance potassium-ion batteries,recent advance rational design highperformance potassiumion battery
Clinical applications of stem cell-derived exosomes,clinical application stem cellderived exosomes
Lecturas: del espacio íntimo al espacio público,lecturas del espacio íntimo al espacio público
An Extension of the Basic Theorems on Classical Welfare Economics,extension basic theorem classical welfare economics
Дополнительное образование детей,дополнительное образование детей
Byzantine theology: Historical trends and doctrinal themes,byzantine theology historical trend doctrinal theme
Gpqa: A graduate-level google-proof q&a benchmark,gpqa graduatelevel googleproof qa benchmark
Managing and using information systems: A strategic approach,managing using information system strategic approach
Coulomb interaction in thin semiconductor and semimetal films,coulomb interaction thin semiconductor semimetal film
"Synthesis of green nanoparticles for energy, biomedical, environmental, agricultural, and food applications: A review",synthesis green nanoparticles energy biomedical environmental agricultural food application review
A survey of GPT-3 family large language models including ChatGPT and GPT-4,survey gpt family large language model including chatgpt gpt
Organisation: Grundlagen moderner Organisationsgestaltung. Mit Fallstudien,organisation grundlagen moderner organisationsgestaltung mit fallstudien
"Leveraging ChatGPT and other generative artificial intelligence (AI)-based applications in the hospitality and tourism industry: practices, challenges and research …",leveraging chatgpt generative artificial intelligence aibased application hospitality tourism industry practice challenge research …
Rlhf-v: Towards trustworthy mllms via behavior alignment from fine-grained correctional human feedback,rlhfv towards trustworthy mllms via behavior alignment finegrained correctional human feedback
"Gut microbiota, intestinal permeability, and systemic inflammation: a narrative review",gut microbiota intestinal permeability systemic inflammation narrative review
Формирование познавательной деятельности младших школьников с использованием STEM-технологии на уроках математики,формирование познавательной деятельности младших школьников с использованием stemтехнологии на уроках математики
Sobre a verdade ea mentira no sentido extra-moral,sobre verdade ea mentira sentido extramoral
"Self-assembled monolayers for interfacial engineering in solution-processed thin-film electronic devices: design, fabrication, and applications",selfassembled monolayers interfacial engineering solutionprocessed thinfilm electronic device design fabrication application
Tinyllama: An open-source small language model,tinyllama opensource small language model
Aficamten for symptomatic obstructive hypertrophic cardiomyopathy,aficamten symptomatic obstructive hypertrophic cardiomyopathy
Exploring the potential of large language models (llms) in learning on graphs,exploring potential large language model llm learning graph
A Reconsideration of the Theory of Value,reconsideration theory value
One-2-3-45++: Fast single image to 3d objects with consistent multi-view generation and 3d diffusion,one fast single image object consistent multiview generation diffusion
"AI-powered marketing: What, where, and how?",aipowered marketing
Ragas: Automated evaluation of retrieval augmented generation,ragas automated evaluation retrieval augmented generation
Lavie: High-quality video generation with cascaded latent diffusion models,lavie highquality video generation cascaded latent diffusion model
Package 'hts',package hts
"Ransomware reloaded: Re-examining its trend, research and mitigation in the era of data exfiltration",ransomware reloaded reexamining trend research mitigation era data exfiltration
The GenAI is out of the bottle: generative artificial intelligence from a business model innovation perspective,genai bottle generative artificial intelligence business model innovation perspective
Sequential modeling enables scalable learning for large vision models,sequential modeling enables scalable learning large vision model
"Health inequality: an introduction to concepts, theories and methods",health inequality introduction concept theory method
jtools: Analysis and presentation of social scientific data,jtools analysis presentation social scientific data
COSMIC: a curated database of somatic variants and clinical data for cancer,cosmic curated database somatic variant clinical data cancer
A comprehensive survey of hallucination mitigation techniques in large language models,comprehensive survey hallucination mitigation technique large language model
Theranostic fluorescent probes,theranostic fluorescent probe
Psychology of the unconscious,psychology unconscious
Comparative analysis between capital and liability-Sensitivity Method,comparative analysis capital liabilitysensitivity method
Evaluation metrics and statistical tests for machine learning,evaluation metric statistical test machine learning
"Zoonomia, or, the laws of organic life",zoonomia law organic life
One-step diffusion with distribution matching distillation,onestep diffusion distribution matching distillation
2666,
A 10-micrometer-thick nanomesh-reinforced gas-permeable hydrogel skin sensor for long-term electrophysiological monitoring,micrometerthick nanomeshreinforced gaspermeable hydrogel skin sensor longterm electrophysiological monitoring
Cybercrime: The transformation of crime in the information age,cybercrime transformation crime information age
Group Psychology and the Analysis of the Ego:[Illustrated & Psychology Glossary & Index Added Inside],group psychology analysis egoillustrated psychology glossary index added inside
Anarchism and other essays,anarchism essay
Tratado político,tratado político
Muscle abnormalities worsen after post-exertional malaise in long COVID,muscle abnormality worsen postexertional malaise long covid
Accurate prediction of protein–nucleic acid complexes using RoseTTAFoldNA,accurate prediction protein–nucleic acid complex using rosettafoldna
Splatter image: Ultra-fast single-view 3d reconstruction,splatter image ultrafast singleview reconstruction
En el enjambre,en el enjambre
"Bureaucracy, politics, and decision making in post-Mao China",bureaucracy politics decision making postmao china
Modelling transport,modelling transport
Rational molecular and device design enables organic solar cells approaching 20% efficiency,rational molecular device design enables organic solar cell approaching efficiency
Artificial intelligence and illusions of understanding in scientific research,artificial intelligence illusion understanding scientific research
Gs-slam: Dense visual slam with 3d gaussian splatting,gsslam dense visual slam gaussian splatting
Hallucination is inevitable: An innate limitation of large language models,hallucination inevitable innate limitation large language model
Grounded sam: Assembling open-world models for diverse visual tasks,grounded sam assembling openworld model diverse visual task
A Lei Maria da Penha na justiça,lei maria da penha na justiça
Water electrolysis for hydrogen production: from hybrid systems to self-powered/catalyzed devices,water electrolysis hydrogen production hybrid system selfpoweredcatalyzed device
Rapid advances enabling high-performance inverted perovskite solar cells,rapid advance enabling highperformance inverted perovskite solar cell
Establishing reaction networks in the 16-electron sulfur reduction reaction,establishing reaction network electron sulfur reduction reaction
The Charter of the United Nations: a commentary,charter united nation commentary
Glamm: Pixel grounding large multimodal model,glamm pixel grounding large multimodal model
Spatialvlm: Endowing vision-language models with spatial reasoning capabilities,spatialvlm endowing visionlanguage model spatial reasoning capability
Fenómeno de la vida,fenómeno de la vida
Mitochondrial dysfunction: mechanisms and advances in therapy,mitochondrial dysfunction mechanism advance therapy
Simple versus radical hysterectomy in women with low-risk cervical cancer,simple versus radical hysterectomy woman lowrisk cervical cancer
Hukum perizinan dalam sektor pelayanan publik,hukum perizinan dalam sektor pelayanan publik
Interfacial solar evaporation: from fundamental research to applications,interfacial solar evaporation fundamental research application
"Lung cancer statistics, 2023",lung cancer statistic
6. Glycemic Goals and Hypoglycemia: Standards of Care in Diabetes—2024,glycemic goal hypoglycemia standard care diabetes—
Tourist Experiences: Insights from Psychology,tourist experience insight psychology
Metal Ions in Biological Systems: Volume 17: Calcium and its Role in Biology,metal ion biological system volume calcium role biology
Diagnostic accuracy of a plasma phosphorylated tau 217 immunoassay for Alzheimer disease pathology,diagnostic accuracy plasma phosphorylated tau immunoassay alzheimer disease pathology
Symphonize 3d semantic scene completion with contextual instance queries,symphonize semantic scene completion contextual instance query
The empire of civil society: a critique of the realist theory of international relations,empire civil society critique realist theory international relation
Prevalence,prevalence
2d gaussian splatting for geometrically accurate radiance fields,gaussian splatting geometrically accurate radiance field
Memristor‐based neuromorphic chips,memristor‐based neuromorphic chip
The public order of the oceans: a contemporary international law of the sea,public order ocean contemporary international law sea
"Long COVID science, research and policy",long covid science research policy
TRIPOD+ AI statement: updated guidance for reporting clinical prediction models that use regression or machine learning methods,tripod ai statement updated guidance reporting clinical prediction model use regression machine learning method
Yi: Open foundation models by 01. ai,yi open foundation model ai
"Safety, efficacy and determinants of response of allogeneic CD19-specific CAR-NK cells in CD19+ B cell tumors: a phase 1/2 trial",safety efficacy determinant response allogeneic cdspecific carnk cell cd b cell tumor phase trial
Contributions to philosophy,contribution philosophy
"MXene‐enabled pneumatic multiscale shape morphing for adaptive, programmable and multimodal radar‐infrared compatible camouflage",mxene‐enabled pneumatic multiscale shape morphing adaptive programmable multimodal radar‐infrared compatible camouflage
"Bge m3-embedding: Multi-lingual, multi-functionality, multi-granularity text embeddings through self-knowledge distillation",bge membedding multilingual multifunctionality multigranularity text embeddings selfknowledge distillation
International relations theories: Discipline and diversity,international relation theory discipline diversity
Energy transfer photocatalysis: exciting modes of reactivity,energy transfer photocatalysis exciting mode reactivity
Three-year outcomes of post-acute sequelae of COVID-19,threeyear outcome postacute sequela covid
Deepseekmath: Pushing the limits of mathematical reasoning in open language models,deepseekmath pushing limit mathematical reasoning open language model
Trial of thrombectomy for stroke with a large infarct of unrestricted size,trial thrombectomy stroke large infarct unrestricted size
Современные операционные системы,современные операционные системы
A review on quantum approximate optimization algorithm and its variants,review quantum approximate optimization algorithm variant
Materials-driven soft wearable bioelectronics for connected healthcare,materialsdriven soft wearable bioelectronics connected healthcare
"Postacute sequelae of SARS-CoV-2 infection in the pre-delta, delta, and omicron eras",postacute sequela sarscov infection predelta delta omicron era
Descemet's stripping automated endothelial keratoplasty,descemets stripping automated endothelial keratoplasty
Excellent low‐frequency microwave absorption and high thermal conductivity in polydimethylsiloxane composites endowed by hydrangea‐like CoNi@ BN …,excellent low‐frequency microwave absorption high thermal conductivity polydimethylsiloxane composite endowed hydrangea‐like coni bn …
A survey on generative diffusion models,survey generative diffusion model
Hukum Pidana Islam,hukum pidana islam
2024 IEEE International Conference on Robotics and Automation (ICRA),ieee international conference robotics automation icra
The Flora of British India: Vol. I,flora british india vol
Manajemen sumber daya manusia,manajemen sumber daya manusia
Language difference in writing: Toward a translingual approach,language difference writing toward translingual approach
Large language models are zero-shot rankers for recommender systems,large language model zeroshot ranker recommender system
Persistent complement dysregulation with signs of thromboinflammation in active Long Covid,persistent complement dysregulation sign thromboinflammation active long covid
"The second data release from the European Pulsar Timing Array-IV. Implications for massive black holes, dark matter, and the early Universe",second data release european pulsar timing arrayiv implication massive black hole dark matter early universe
Nitrogen transformations,nitrogen transformation
Toward an ecological society,toward ecological society
"Nanomedicine, volume I: basic capabilities",nanomedicine volume basic capability
Impact of AI assistance on student agency,impact ai assistance student agency
Rapid groundwater decline and some cases of recovery in aquifers globally,rapid groundwater decline case recovery aquifer globally
Transformers are ssms: Generalized models and efficient algorithms through structured state space duality,transformer ssms generalized model efficient algorithm structured state space duality
The world of plastic waste: a review,world plastic waste review
"Epidemiology of pneumococcal meningitis in sentinel hospital surveillance of Viet Nam, 2015–2018",epidemiology pneumococcal meningitis sentinel hospital surveillance viet nam –
A survey on large language models for recommendation,survey large language model recommendation
Practical statistics for educators,practical statistic educator
Unveiling the crucial role of soil microorganisms in carbon cycling: A review,unveiling crucial role soil microorganism carbon cycling review
Do AI chatbots improve students learning outcomes? Evidence from a meta‐analysis,ai chatbots improve student learning outcome evidence meta‐analysis
